{
  "$schema": "https://json-schema.org/draft/2020-12/schema",
  "$id": "https://yeongseon.github.io/azure-app-service-practical-guide/schemas/golden/reproduction.schema.json",
  "title": "Golden v1 independent reproduction record",
  "type": "object",
  "additionalProperties": false,
  "description": "One attempt by a second operator to reach the same verdict from the documentation alone. Verdict agreement and documentation quality are recorded separately: a reviewer who read source to fill a gap proved the code works, not the docs.",
  "required": [
    "reviewer",
    "reviewer_kind",
    "original_operator",
    "original_operator_kind",
    "commit",
    "attempted_at",
    "scenario",
    "original_run_id",
    "original_hypothesis_status",
    "replay_hypothesis_status",
    "consulted_source_to_fill_doc_gap",
    "deviations"
  ],
  "properties": {
    "reviewer": {
      "type": "string",
      "minLength": 1,
      "description": "Must differ from original_operator."
    },
    "original_operator": {
      "type": "string",
      "minLength": 1
    },
    "reviewer_kind": {
      "enum": [
        "human",
        "agent"
      ],
      "description": "Only human reviewers can satisfy the independent-reproduction gate."
    },
    "original_operator_kind": {
      "enum": [
        "human",
        "agent"
      ],
      "description": "The original run must also be attributable to a human operator for human independence."
    },
    "commit": {
      "type": "string",
      "minLength": 7
    },
    "attempted_at": {
      "type": "string",
      "oneOf": [
        {"format": "date-time"},
        {"format": "date"}
      ],
      "description": "Attempt time. Date-only values are retained pre-contract records; new attempts must use date-time."
    },
    "scenario": {
      "type": "string",
      "minLength": 1
    },
    "original_run_id": {
      "type": "string",
      "minLength": 1
    },
    "replay_run_id": {
      "type": [
        "string",
        "null"
      ],
      "description": "null when the attempt did not happen. Must differ from original_run_id: a replay carrying the same id is the same evidence."
    },
    "original_hypothesis_status": {
      "enum": [
        "SUPPORTED",
        "CONTRADICTED",
        "INCONCLUSIVE",
        "NOT_TESTED"
      ]
    },
    "replay_hypothesis_status": {
      "enum": [
        "SUPPORTED",
        "CONTRADICTED",
        "INCONCLUSIVE",
        "NOT_TESTED"
      ]
    },
    "consulted_source_to_fill_doc_gap": {
      "type": "boolean",
      "description": "True fails the DOCUMENTATION result even when the verdict matches."
    },
    "deviations": {
      "type": "array",
      "items": {
        "type": "object",
        "required": [
          "kind"
        ],
        "properties": {
          "step": {
            "type": "string"
          },
          "kind": {
            "enum": [
              "undocumented-step",
              "incorrect-step",
              "missing-prerequisite",
              "environment-difference"
            ]
          },
          "detail": {
            "type": "string"
          },
          "resolution": {
            "type": "string",
            "description": "How this deviation was addressed after the reproduction. Recording it here keeps the finding and its repair together without altering what was observed."
          }
        }
      }
    },
    "blocked_reason": {
      "type": [
        "string",
        "null"
      ]
    },
    "attestation": {
      "type": "object",
      "additionalProperties": false,
      "required": [
        "url",
        "reviewer_login",
        "original_operator_login",
        "pr_author_login"
      ],
      "properties": {
        "url": {
          "type": "string",
          "pattern": "^https://github\\.com/[^/]+/[^/]+/pull/[0-9]+#pullrequestreview-[0-9]+$",
          "description": "Externally verifiable GitHub pull-request review or approval URL. Offline checking leaves this attestation unverified."
        },
        "reviewer_login": {"type": "string", "minLength": 1},
        "original_operator_login": {"type": "string", "minLength": 1},
        "pr_author_login": {"type": "string", "minLength": 1}
      }
    },
    "note": {
      "type": "string",
      "description": "Commentary on the record itself, such as whether the deviations it reports have since been repaired. A reproduction record describes what one operator encountered and is never edited to reflect later fixes, so this is where that context lives."
    }
  }
}
