{
  "scenario": "deployment-succeeded-startup-failed",
  "commit": "eb731a1d8e9d3b7ebcd9ec73a7f8c341e8a00aea",
  "attempted_at": "2026-09-27",
  "original_operator": "sisyphus-authoring-session",
  "original_operator_kind": "agent",
  "original_run_id": "20260927T104304Z-aba0d3a9daa7",
  "original_hypothesis_status": "SUPPORTED",
  "reviewer": "independent-reproduction-agent",
  "reviewer_kind": "agent",
  "replay_run_id": "20260927T223558Z-e391956951c1",
  "replay_hypothesis_status": "SUPPORTED",
  "blocked_reason": null,
  "consulted_source_to_fill_doc_gap": false,
  "deviations": [
    {
      "kind": "incorrect-step",
      "detail": "The lab guide and the evidence model state different exit-code meanings. The guide maps 1 to FAIL and 3 to CONTRADICTED; the model maps 1 to CONTRADICTED and 3 to NOT_TESTED. The run exited 0 so the result was unaffected, but a failing or contradicted run would be ambiguous.",
      "resolution": "Fixed: both tools now publish one EXIT_CODES mapping and evidence-validation failure uses a separate code 4, pinned by tests/golden/test_exit_code_agreement.py."
    },
    {
      "kind": "undocumented-step",
      "detail": "cleanup.sh is not mentioned in the published runbook, which documents run.py cleanup instead. The reproducer executed it only because the reproduction instructions required it.",
      "resolution": "Fixed: the runbook documents cleanup.sh in section 3.0 with a command table."
    },
    {
      "kind": "incorrect-step",
      "detail": "The evidence model describes a run directory of manifest.json and evidence.json and says the evaluator reads exactly two files. This scenario writes run.json and phase directories and no result.json, and nothing explains the relationship between the scenario format and the generic model.",
      "resolution": "Fixed: the evidence model explains both run layouts and how a collector bridges them."
    },
    {
      "kind": "undocumented-step",
      "detail": "run.py --help lists subcommands without their positional arguments, so the CLI alone is insufficient to construct an invocation.",
      "resolution": "Fixed: every run.py argument carries help text, so --help is sufficient to construct a call."
    },
    {
      "kind": "incorrect-step",
      "detail": "The runbook interleaves historical observed values with the current procedure, so an operator must work to separate retained examples from acceptance criteria for a fresh run.",
      "resolution": "Fixed: the runbook carries an explicit notice that historical observed values are not acceptance criteria for a fresh run."
    }
  ],
  "note": "This record preserves an AI-agent repeat run from 2026-09-27. It is not independent human reproduction and cannot satisfy #179. Every deviation remains preserved with its later resolution; closing the item needs a fresh reproduction against the corrected documentation by a genuinely different human operator."
}
